{
  "name": "course-writer",
  "version": "1.1.0",
  "description": "Generates and validates publication-ready Markdown course lessons for the Nuniversity platform, including learning-engine metadata, spaced-review-ready questions, and deterministic quality checks",
  "type": "skill",
  "triggers": ["content/courses/**"],
  "dependencies": ["pyyaml"],
  "metadata": {
    "category": "content-creation",
    "audience": "course-creators",
    "difficulty": "intermediate"
  }
}
